{
	"type": "object",
	"$schema": "http://json-schema.org/draft-03/schema",
	"id": "http://jsonschema.net",
	"required": true,
	"properties": {
		"personId": {
			"type": "integer",
			"required": false
		},
		"userId": {
			"type": "string",
			"required": true,
			"maxLength": 32
		},
		"firstName": {
			"type": "string",
			"required": true,
			"maxLength": 255
		},
		"middleName": {
			"type": "string",
			"required": false,
			"maxLength": 255
		},
		"lastName": {
			"type": "string",
			"required": false,
			"maxLength": 255
		},
		"administratorId": {
			"type": "integer",
			"required": false
		},
		"changeDate": {
			"type": "date",
			"required": true
		},
		"changeUser": {
			"type": "string",
			"required": true,
			"maxLength": 32
		}
	}
}
