[
	{ "personId" : 1,
		"userId" : "jdoe",
		"firstName" : "John",
		"lastName" : "Doe",
		"changeDate" : "Sun, 06 Nov 1994 08:49:37 GMT",
		"changeUser" : "SYSADMIN"
	},
	{ "personId" : 2,
		"userId": "bsmith",
		"firstName" : "Bob",
		"middleName" : "A",
		"lastName" : "Smith",
		"administratorId" : 1,
		"changeDate": "Sun, 06 Nov 1994 08:49:37 GMT",
		"changeUser" : "SYSADMIN"
	}
]
